факультете мировой экономики мировой|3
мировой экономики мировой политики|2
Корпуса разбросаны всей Москве.|2
свободного времени, возможность совмещать|2
знаю, обстоят дела других|2
Есть такие, которых семинары|2
такие, которых семинары представляют|2
которых семинары представляют собой|2
Являюсь выпускницей программы двух|1
выпускницей программы двух дипломов|1
программы двух дипломов ВШЭ|1
двух дипломов ВШЭ Лондонским|1
дипломов ВШЭ Лондонским университетом|1
ВШЭ Лондонским университетом (МИЭФ).|1
Лондонским университетом (МИЭФ). Качество|1
университетом (МИЭФ). Качество образования|1
(МИЭФ). Качество образования (по|1
Качество образования (по крайней|1
образования (по крайней мере|1
(по крайней мере требования|1
