ген директор ивучукву бенджамин|5
директор ивучукву бенджамин ученный|5
ивучукву бенджамин ученный ооо|4
привет читатель сайт отзыв|1
читатель сайт отзыв искать|1
сайт отзыв искать хороший|1
отзыв искать хороший позволять|1
искать хороший позволять становиться|1
хороший позволять становиться крутой|1
позволять становиться крутой программист|1
становиться крутой программист точно|1
крутой программист точно лэти|1
программист точно лэти рассказывать|1
точно лэти рассказывать почему|1
лэти рассказывать почему выбирать|1
рассказывать почему выбирать прочитывать|1
почему выбирать прочитывать восхищенный|1
выбирать прочитывать восхищенный отзыв|1
прочитывать восхищенный отзыв лэти|1
восхищенный отзыв лэти давать|1
