информационный аналитический система безопасность|4
специальность информационный аналитический система|3
процесс рамка ваш программа|2
направление ядерный физика технология|2
привет рассказывать почему должный|1
рассказывать почему должный полюбить|1
почему должный полюбить химия|1
должный полюбить химия выучивать|1
полюбить химия выучивать матан|1
химия выучивать матан подумать|1
выучивать матан подумать поступление|1
матан подумать поступление любой|1
подумать поступление любой итак|1
поступление любой итак поступать|1
любой итак поступать мифь|1
итак поступать мифь год|1
поступать мифь год суть|1
мифь год суть проучиться|1
год суть проучиться месяц|1
суть проучиться месяц рассказывать|1
